{
  "$schema":"https://json-schema.org/draft/2020-12/schema","type":"object","required":["schema_version","contract_id","contract_version","run_id","case_id","stage","attempt","idempotency_key","status","started_at","completed_at","inputs","outputs","result","decisions","warnings","errors","retryable","tool_calls","runtime","publishing_enabled","real_production_enabled"],
  "properties":{
    "schema_version":{"type":"string","enum":["1.0"]},"contract_id":{"type":"string","enum":["cold-truth.writer"]},"contract_version":{"type":"string","enum":["1.0.0-c3-fixture"]},"run_id":{"type":"string","enum":["phase-c3-writer-fixture"]},"case_id":{"type":"string","enum":["glass-river-writing-fixture"]},"stage":{"type":"string","enum":["writer_fixture"]},"attempt":{"type":"integer","enum":[1]},"idempotency_key":{"type":"string","pattern":"^[a-f0-9]{64}$"},"status":{"type":"string","enum":["success"]},"started_at":{"type":"string","enum":["2026-07-12T00:00:00Z"]},"completed_at":{"type":"string","enum":["2026-07-12T00:00:00Z"]},
    "inputs":{"type":"array","items":{"type":"object","required":["name","type","kind","path","sha256","size_bytes"],"properties":{"name":{"type":"string"},"type":{"type":"string"},"kind":{"type":"string","enum":["file"]},"path":{"type":"string"},"sha256":{"type":"string","pattern":"^[a-f0-9]{64}$"},"size_bytes":{"type":"integer"}},"additionalProperties":false}},
    "outputs":{"type":"array","items":{"type":"object","required":[],"properties":{},"additionalProperties":false}},
    "result":{"type":"object","required":["upstream_research_verifier_handoff_hash","approved_claim_1","approved_claim_2","approved_claim_3","excluded_claim_1","excluded_claim_2","excluded_claim_3","section_1","section_2","section_3","sentence_1","sentence_2","sentence_3","attribution_1","attribution_2","attribution_3","narration_text","word_count","unsupported_claim_check","external_research_used","browser_used","mcp_used","network_used","artifact_hashes","ready_for_editor"],"properties":{
      "upstream_research_verifier_handoff_hash":{"type":"string","pattern":"^[a-f0-9]{64}$"},"approved_claim_1":{"type":"string","enum":["SYN-RV-01"]},"approved_claim_2":{"type":"string","enum":["SYN-RV-02"]},"approved_claim_3":{"type":"string","enum":["SYN-RV-03"]},"excluded_claim_1":{"type":"string","enum":["SYN-RV-X1"]},"excluded_claim_2":{"type":"string","enum":["SYN-RV-X2"]},"excluded_claim_3":{"type":"string","enum":["SYN-RV-X3"]},
      "section_1":{"type":"string","enum":["event_date"]},"section_2":{"type":"string","enum":["event_location"]},"section_3":{"type":"string","enum":["current_status"]},
      "sentence_1":{"type":"string","enum":["A fictional official record fixes the event date as April 17, 2042."]},"sentence_2":{"type":"string","enum":["A second fictional official record places the event at Glass River Annex in Example District."]},"sentence_3":{"type":"string","enum":["A fictional archive records a current-status update dated September 8, 2044."]},
      "attribution_1":{"type":"string","enum":["SYN-RV-01"]},"attribution_2":{"type":"string","enum":["SYN-RV-02"]},"attribution_3":{"type":"string","enum":["SYN-RV-03"]},"narration_text":{"type":"string","enum":["A fictional official record fixes the event date as April 17, 2042. A second fictional official record places the event at Glass River Annex in Example District. A fictional archive records a current-status update dated September 8, 2044."]},"word_count":{"type":"integer","enum":[38]},"unsupported_claim_check":{"type":"string","enum":["passed"]},"external_research_used":{"type":"boolean","enum":[false]},"browser_used":{"type":"boolean","enum":[false]},"mcp_used":{"type":"boolean","enum":[false]},"network_used":{"type":"boolean","enum":[false]},"artifact_hashes":{"type":"object","required":[],"properties":{},"additionalProperties":false},"ready_for_editor":{"type":"boolean","enum":[true]}
    },"additionalProperties":false},
    "decisions":{"type":"array","items":{"type":"object","required":["rule","result"],"properties":{"rule":{"type":"string","enum":["synthetic_writer_only"]},"result":{"type":"string","enum":["pass"]}},"additionalProperties":false}},"warnings":{"type":"array","items":{"type":"string"}},"errors":{"type":"array","items":{"type":"string"}},"retryable":{"type":"boolean","enum":[false]},"tool_calls":{"type":"array","items":{"type":"object","required":[],"properties":{},"additionalProperties":false}},"runtime":{"type":"object","required":["provider","runtime","model","version"],"properties":{"provider":{"type":"string","enum":["codex-exec"]},"runtime":{"type":"string","enum":["controlled-real-fixture"]},"model":{"type":"string","enum":["not-reported"]},"version":{"type":"string","enum":["not-reported"]}},"additionalProperties":false},"publishing_enabled":{"type":"boolean","enum":[false]},"real_production_enabled":{"type":"boolean","enum":[false]}
  },"additionalProperties":false
}
